root@comp3134Winter2026:~# sudo tcpdump -i eth0 -c 5 host 198.96.85.106
tcpdump: verbose output suppressed, use -v[v]... for full protocol decode
listening on eth0, link-type EN10MB (Ethernet), snapshot length 262144 bytes
18:47:50.038422 IP 198.96.85.106.52590 > comp3134Winter2026.ssh: Flags [P.], seq 2530017784:2530017820, ack 3875226163, win 2048, options [nop,nop,TS val 3663311840 ecr 734310482], length 36
18:47:50.038602 IP comp3134Winter2026.ssh > 198.96.85.106.52590: Flags [P.], seq 1:37, ack 36, win 982, options [nop,nop,TS val 734310505 ecr 3663311840], length 36
18:47:50.041075 IP comp3134Winter2026.ssh > 198.96.85.106.52590: Flags [P.], seq 37:145, ack 36, win 982, options [nop,nop,TS val 734310507 ecr 3663311840], length 108
18:47:50.041172 IP comp3134Winter2026.ssh > 198.96.85.106.52590: Flags [P.], seq 145:181, ack 36, win 982, options [nop,nop,TS val 734310507 ecr 3663311840], length 36
18:47:50.041247 IP comp3134Winter2026.ssh > 198.96.85.106.52590: Flags [P.], seq 181:233, ack 36, win 982, options [nop,nop,TS val 734310507 ecr 3663311840], length 52
5 packets captured
30 packets received by filter
0 packets dropped by kernel