root@comp3134Winter2026:~# sudo tcpdump -n -i eth0 -c 5
tcpdump: verbose output suppressed, use -v[v]... for full protocol decode
listening on eth0, link-type EN10MB (Ethernet), snapshot length 262144 bytes
18:45:50.452656 IP 198.96.85.106.52590 > 159.89.125.218.22: Flags [P.], seq 2530003312:2530003348, ack 3875206455, win 2048, options [nop,nop,TS val 3663192256 ecr 734190899], length 36
18:45:50.452803 IP 159.89.125.218.22 > 198.96.85.106.52590: Flags [P.], seq 1:37, ack 36, win 982, options [nop,nop,TS val 734190919 ecr 3663192256], length 36
18:45:50.453825 IP 159.89.125.218.22 > 198.96.85.106.52590: Flags [P.], seq 37:145, ack 36, win 982, options [nop,nop,TS val 734190920 ecr 3663192256], length 108
18:45:50.453921 IP 159.89.125.218.22 > 198.96.85.106.52590: Flags [P.], seq 145:181, ack 36, win 982, options [nop,nop,TS val 734190920 ecr 3663192256], length 36
18:45:50.453994 IP 159.89.125.218.22 > 198.96.85.106.52590: Flags [P.], seq 181:233, ack 36, win 982, options [nop,nop,TS val 734190920 ecr 3663192256], length 52
5 packets captured
22 packets received by filter
0 packets dropped by kernel
